<?xml version="1.0" encoding="UTF-8"?>
<LanguageData xsi:noNamespaceSchemaLocation="_pilotSchema_8.xsd" xmlns:xsi="http://www.w3.org/2001/XMLSchema-instance">
	<Language>
		<GeneralInfo>
			<LangID>Baure</LangID>
			<ISO639-3>brg</ISO639-3>
			<Location>South America</Location>
			<Country>Bolivia</Country>
			<GeneticRelation> Arawakan/Maipurean</GeneticRelation>
			<WordOrder>???</WordOrder>
			<CaseSystem>???</CaseSystem>
			<NominalPhrase>???</NominalPhrase>
			<!-- Comment here to show how Git Hub works -->
		</GeneralInfo>
		<Possession>
			<PronominalPossession>
					<!--  StrategyID="5" is the default to mark elided possessed, this is the strategy used for Spanish borrowings??? -->
				<Strategy Complexity="symplex" Replaceable="no" StrategyID="1">
					 <!-- <Remark>This strategy makes use of bound roots. These roots are also often parts of classifiers. They don't appear on their own, a special prefix -e is needed to make the noun unpossessed. This difference between the two strategies cannot be reflectedd properly in our database
				But it can be seen in one additional pronoun form "unspecified"
 
				</Remark> -->
					<Semantics>
						<Posessor> 
human, plant, animal
							<Resources>Danielsen2007</Resources>
						</Posessor>
						<Possessed ObligatoryPossessed="yes" BodyParts="all" PlantParts="all" Clothes="all" Kinship="?all" Others="some">
							<Remark>Kinship terms which are borrowed from Spanish use another strategy to mark possession - with possessive pronoun (nowadays they are in use much more than the original Baure words)
						</Remark>
						body parts: head, brain, eye, tongue, tooth, skin, face, back, hand palm, plant parts: leaf, stem, branch, tree, kinship, clothes (although borrowed from Spanish), 'field', 'feather', 'horn'
						<Resources>Danielsen2007</Resources>
						</Possessed>
						<RelationPRPD>
							inalienable
					       	<Resources>Danielsen2007:118</Resources>
						</RelationPRPD>
					</Semantics>
					<Morphology>
						<Pronoun Dedication="Not dedicated" SharedwithNominal="yes" FreeBound="Bound">
							<Remark>The same pronominal clitics mark subject agreement on the verbs (and object agreement) Danielsen2007: 92
					</Remark>
							<pron person="1" number="singular">ni-</pron>
							<pron person="1" number="plural">vi-</pron>
							<pron person="2" number="singular">pi-</pron>
							<pron person="2" number="plural">yi-</pron>
							<pron person="3" number="singular" gender="msc">ro-</pron>
							<pron person="3" number="singular" gender="fem">ri-</pron>
							<pron person="3" number="plural">no-</pron>
							<pron person="unspecified" number="unspecified">e-</pron>
							<Asymmetry></Asymmetry>
						</Pronoun>
					</Morphology>
					<SyntEnvironment>
						<Adnominal>
							<Text>ntorak to e-ser</Text>
							<Gloss>1sg=find art unspecified-tooth</Gloss>
							<Translation>I found a tooth (I don't know whose)</Translation>
							<Resources></Resources>
						</Adnominal>
						<Predicative SpecialForm="?">
							<Text></Text>
							<Gloss></Gloss>
							<Translation></Translation>
							<Resources>not_found</Resources>
						</Predicative>
						<EllidedPossessed SpecialForm="?">
							<Text></Text>
							<Gloss></Gloss>
							<Translation></Translation>
							<Resources>not_found</Resources>
						</EllidedPossessed>
					</SyntEnvironment>
				
				</Strategy>
				<Strategy Complexity="symplex" Replaceable="no" StrategyID="2">
					<Semantics>
						<Posessor> 
								?
							<Resources></Resources>
						</Posessor>
						<Possessed ObligatoryPossessed="no">
						'glasses'
						<Resources>Danielsen2007</Resources>
						</Possessed>
						<RelationPRPD>
							alienable
							<Resources>Danielsen2007:123</Resources>
						</RelationPRPD>
					</Semantics>
					<Morphology>
						<Pronoun Dedication="Not dedicated" SharedwithNominal="yes" FreeBound="Bound">
							<Remark>The same pronominal clitics mark subject agreement on the verbs (and object agreement) Danielsen2007: 92
					</Remark>
							<pron person="1" number="singular">ni-</pron>
							<pron person="1" number="plural">vi-</pron>
							<pron person="2" number="singular">pi-</pron>
							<pron person="2" number="plural">yi-</pron>
							<pron person="3" number="singular" gender="msc">ro-</pron>
							<pron person="3" number="singular" gender="fem">ri-</pron>
							<pron person="3" number="plural">no-</pron>
							<Asymmetry></Asymmetry>
						</Pronoun>
					</Morphology>
					<SyntEnvironment>
						<Adnominal>
							<Text>nihaƒçkis</Text>
							<Gloss>1sg=glasses</Gloss>
							<Translation>my glasses</Translation>
							<Resources></Resources>
						</Adnominal>
						<Predicative SpecialForm="?">
							<Text></Text>
							<Gloss></Gloss>
							<Translation></Translation>
							<Resources>not_found</Resources>
						</Predicative>
						<EllidedPossessed SpecialForm="?">
							<Text></Text>
							<Gloss></Gloss>
							<Translation></Translation>
							<Resources>not_found</Resources>
						</EllidedPossessed>
					</SyntEnvironment>
				</Strategy>
				<Strategy Complexity="complex" Replaceable="no" StrategyID="3">
					<Semantics>
						<Posessor> 
								?				
							<Resources></Resources>
						</Posessor>
						<Possessed ObligatoryPossessed="no">
						'firewood', 'jar', 'chief', 'basket', 'blood', 'water', 'fire'
						<Resources>Danielsen2007</Resources>
						</Possessed>
						<RelationPRPD>
							alienable
							<Resources>Danielsen2007:123</Resources>
						</RelationPRPD>
					</Semantics>
					<Morphology>
						<Pronoun Dedication="Not dedicated" SharedwithNominal="yes" FreeBound="Bound">
							<Remark>The same pronominal clitics mark subject agreement on the verbs (and object agreement) Danielsen2007: 92
					</Remark>
							<pron person="1" number="singular">ni-</pron>
							<pron person="1" number="plural">vi-</pron>
							<pron person="2" number="singular">pi-</pron>
							<pron person="2" number="plural">yi-</pron>
							<pron person="3" number="singular" gender="msc">ro-</pron>
							<pron person="3" number="singular" gender="fem">ri-</pron>
							<pron person="3" number="plural">no-</pron>
						</Pronoun>
						<Morpheme SharedWithNominal="yes" pronoun="no" FreeBound="Bound">
							<Remark>This morpheme is a "nominlaizer", it has many usages in the language, see 5.2.4,  9.4, 10.2
					</Remark>
							<morph> 
					-no
					</morph>
						</Morpheme>
					</Morphology>
					<SyntEnvironment>
						<Adnominal>
							<Text>ni-hapi-n</Text>
							<Gloss>1sg=jar=poss</Gloss>
							<Translation>my jar</Translation>
							<Resources>Danielsen2007:12</Resources>
						</Adnominal>
						<Predicative SpecialForm="?">
							<Text></Text>
							<Gloss></Gloss>
							<Translation></Translation>
							<Resources>not_found</Resources>
						</Predicative>
						<EllidedPossessed SpecialForm="?">
							<Text></Text>
							<Gloss></Gloss>
							<Translation></Translation>
							<Resources>not_found</Resources>
						</EllidedPossessed>
					</SyntEnvironment>
				</Strategy>
				<Strategy Complexity="complex" Replaceable="no" StrategyID="4">
					<Semantics>
						<Posessor> 
								?humans				
							<Resources></Resources>
						</Posessor>
						<Possessed ObligatoryPossessed="no">
						animals
						<Resources>Danielsen2007</Resources>
						</Possessed>
						<RelationPRPD>
							alienable
/inalienable
							<Resources>Danielsen2007:124</Resources>
						</RelationPRPD>
					</Semantics>
					<Morphology>
						<Pronoun Dedication="Not dedicated" SharedwithNominal="yes" FreeBound="Bound">
							<Remark>The same pronominal clitics mark subject agreement on the verbs (and object agreement) Danielsen2007: 92
					</Remark>
							<pron person="1" number="singular">ni-</pron>
							<pron person="1" number="plural">vi-</pron>
							<pron person="2" number="singular">pi-</pron>
							<pron person="2" number="plural">yi-</pron>
							<pron person="3" number="singular" gender="msc">ro-</pron>
							<pron person="3" number="singular" gender="fem">ri-</pron>
							<pron person="3" number="plural">no-</pron>
						</Pronoun>
						<Morpheme SharedWithNominal="?yes" pronoun="no" FreeBound="free">
							<morph> 
					-per 'domestic animal'
					</morph>
						</Morpheme>
					</Morphology>
					<SyntEnvironment>
						<Adnominal>
							<Text>ni-per kove'</Text>
							<Gloss>1sg=dom.animal dog</Gloss>
							<Translation>my dog</Translation>
							<Resources>Danielsen2007:124</Resources>
						</Adnominal>
						<Predicative SpecialForm="?">
							<Text></Text>
							<Gloss></Gloss>
							<Translation></Translation>
							<Resources>not_found</Resources>
						</Predicative>
						<EllidedPossessed SpecialForm="?">
							<Text></Text>
							<Gloss></Gloss>
							<Translation></Translation>
							<Resources>not_found</Resources>
						</EllidedPossessed>
					</SyntEnvironment>
				</Strategy>
				<Strategy Complexity="symplex" Replaceable="no" StrategyID="5">
					<Semantics>
						<Posessor> 
								?
							<Resources></Resources>
						</Posessor>
						<Possessed ObligatoryPossessed="no">
						spanish loanwords, some nouns which don't take possessive suffixes, like 'land'. Danielsen2007:125 classifies them as "non-possessable" but adds that they "can logically be possessed"
						<Resources>Danielsen2007</Resources>
						</Possessed>
						<RelationPRPD>
							alienable
							<Resources>Danielsen2007:123</Resources>
						</RelationPRPD>
					</Semantics>
					<Morphology>
						<Pronoun Dedication="Not dedicated" SharedwithNominal="?yes" FreeBound="Free">